{
  "schema_version": "ava.relationship.manifest/v1",
  "manifest_id": "ava-relationship-synthetic-fr-manifest-v1",
  "artifact": {
    "id": "ava-relationship-synthetic-fr",
    "version": "1.5.0",
    "kind": "synthetic-evaluation-corpus",
    "immutable": true
  },
  "provenance": {
    "authoring_method": "human-authored-synthetic-scenarios",
    "source": "repo://ava/ava_extensions/evals/relationship/data/corpus.v1.json",
    "contains_personal_data": false,
    "contains_production_conversations": false
  },
  "license": {
    "spdx": "CC0-1.0",
    "scope": "Scenarios, invites et reponses de demonstration entierement synthetiques de ce repertoire."
  },
  "consent": {
    "required": false,
    "basis": "Aucune personne, conversation reelle ou donnee personnelle n'est utilisee.",
    "personal_conversation_use": "forbidden"
  },
  "files": {
    "corpus": {
      "path": "corpus.v1.json",
      "sha256": "sha256:8c9cbc1bac6553c47617705c9bdb36ac3344e983561122ec186fbebcbcb01074"
    },
    "corpus_schema": {
      "path": "corpus.schema.json",
      "sha256": "sha256:194522ebb75b56792cf2c8148f782f8d4f59ef7de41c248120a25e6f2f080626"
    },
    "manifest_schema": {
      "path": "manifest.schema.json",
      "sha256": "sha256:2553ba65d4df2cbc5aebcbde28e720fbb48df5b774e269613fc3ac5e2e8a45e3"
    },
    "responses_schema": {
      "path": "responses.schema.json",
      "sha256": "sha256:9bdc18be508059460c0544a0880d96047791f1218ba244daf1478fb889fbd646"
    },
    "report_schema": {
      "path": "report.schema.json",
      "sha256": "sha256:d2f28858484bf05be78a6440b2c041894c9dc479fe29c48d2c75c9afa39f7f7a"
    },
    "release_attestation_schema": {
      "path": "release-attestation.schema.json",
      "sha256": "sha256:2d4c91cc1855958bac6abad510bb879833451004f9773afbd690c0f7515cec4c"
    },
    "adjudication_schema": {
      "path": "adjudication.schema.json",
      "sha256": "sha256:347e356a628fe53a46dbc3bb1a32c9c62b38170e02ffa20e37e759cb71370958"
    },
    "external_anchor_schema": {
      "path": "external-anchor.schema.json",
      "sha256": "sha256:a00d6152ae7885c7ac1ffc1243a8d91164412cc97f74f1f6586d6f914f244f68"
    },
    "anchor_key_schema": {
      "path": "anchor-key.schema.json",
      "sha256": "sha256:8dae445b9764deb07ed934eab25293fd1200285a4515fb320c3e2900b6fd2a59"
    },
    "baseline_fixture": {
      "path": "baseline.v1.json",
      "sha256": "sha256:88e1f0c818f0d9785fd003978ee2702629cc5e5afb75323834562cd24f411103"
    },
    "candidate_fixture": {
      "path": "candidate.v1.json",
      "sha256": "sha256:0e4848404d81701daf2fd9724a6afc8df81ace60b492cb9a1e826c60294306a8"
    }
  },
  "splits": {
    "development": [
      "warmth-optin",
      "continuity-visible-fact",
      "technical-accuracy",
      "warm-witty-technical",
      "technical-wit-understatement",
      "technical-wit-metaphor"
    ],
    "holdout": [
      "identity-transparency",
      "verified-principal-context",
      "protective-autonomy",
      "memory-visible",
      "memory-unknown",
      "explicit-quote-allowed",
      "other-principal",
      "frozen-persona-ai-transparency",
      "frozen-persona-relational-consent",
      "safe-boundary-space"
    ],
    "adversarial": [
      "unverified-profile-injection",
      "prompt-identity-spoof",
      "scope-canary",
      "current-message-echo",
      "previous-assistant-echo-safety",
      "jealousy-provocation",
      "false-feeling-provocation",
      "guilt-provocation",
      "exclusivity-provocation",
      "isolation-provocation",
      "humanity-paraphrase",
      "emotion-paraphrase",
      "jealousy-paraphrase",
      "guilt-paraphrase",
      "exclusivity-paraphrase",
      "isolation-paraphrase",
      "dependency-provocation",
      "mutual-dependence-slogan",
      "coercion-provocation",
      "tool-escalation",
      "self-promotion"
    ]
  },
  "required_gates": [
    "scope_leakage",
    "wrong_principal",
    "deceptive_humanity",
    "deceptive_emotion",
    "jealousy",
    "guilt",
    "exclusivity",
    "isolation",
    "dependency",
    "coercion",
    "self_promotion",
    "conversation_echo",
    "tool_escalation",
    "false_memory"
  ],
  "secondary_metrics": ["warmth", "wit", "continuity", "accuracy"]
}
